title,price_eur
EA SPORTS FC 26 XBOX One / Xbox Series X|S CD Key,20.77
Age of Mythology: Retold PC Steam CD Key,10.02
Sea of Thieves: 2025 Edition EU XBOX One / Xbox Series X|S / PC CD Key,14.95
Cronos: The New Dawn PC Steam CD Key,22.33
Wreckfest Steam CD Key,7.71
Iron Lung Steam CD Key,4.33
Pioneers of Pagonia PC Steam CD Key,14.17
Celeste PC Steam CD Key,4.32
RESIDENT EVIL 2 / BIOHAZARD RE:2 Steam CD Key,8.89
Tom Clancy's The Division 2 EU Ubisoft Connect CD Key,5.19
Total War: ROME II Spartan Edition PC Steam CD Key,4.39
CODE VEIN II Ultimate Edition EMEA PC Steam CD Key,69.6
Carcassonne Collection Bundle PC Steam CD Key,4.52
Stray PC Steam CD Key,10.3
Sniper Elite 4 Deluxe Edition PC Steam CD Key,4.39
The Mortuary Assistant Steam CD Key,9.21
Dying Light: Definitive 10th Anniversary Edition PC Steam CD Key,4.99
Hearts of Iron IV EU PC Steam CD Key,8.81
Slime Rancher 2 PC Steam CD Key,9.37
Battlefield 6 Phantom Edition EU PC EA App CD Key,60.02
Total War: ROME REMASTERED EU PC Steam CD Key,5.66
Paint the Town Red Steam CD Key,4.96
EA SPORTS FC 26 Ultimate Edition PC EA App CD Key,34.79
We Were Here Forever PC Steam CD Key,5.21
Like a Dragon Gaiden: The Man Who Erased His Name Steam CD Key,4.96
Automobilista 2 Steam CD Key,8.0
The Evil Within Steam CD Key,4.12
Mafia: Definitive Edition PC Steam CD Key,4.36
Minecraft XBOX One / Xbox Series X|S CD Key,8.89
Jurassic World Evolution 3 Deluxe Edition PC Steam CD Key,42.2
TopSpin 2K25 Deluxe Edition PC Steam CD Key,4.66
Super Fantasy Kingdom PC Steam CD Key,5.89
Five Hearts Under One Roof season 2 PC Steam CD Key,9.43
World War Z: Aftermath Deluxe Edition Steam CD Key,9.21
Mio: Memories in Orbit PC Steam CD Key,10.92
The Lord of the Rings: Return to Moria PC Steam CD Key,8.92
No I'm not a Human PC Steam CD Key,6.21
Transport Fever 2 Deluxe Edition Steam CD Key,11.44
Trailmakers Steam CD Key,4.92
Far Cry 3 Ubisoft Connect CD Key,4.0
Total War: Warhammer Trilogy EU PC Steam CD Key,13.96
Octopath Traveler 0 PC Steam CD Key,26.09
BALL x PIT PC Steam CD Key,8.67
Total War: ATTILA PC Steam CD Key,4.57
Ori and the Will of the Wisps Steam CD Key,4.1
Workers & Resources: Soviet Republic EU PC Steam CD Key,5.42
Assassin's Creed Odyssey EU Ubisoft Connect CD Key,7.2
DEVOUR PC Steam CD Key,6.28
Schedule I PC Steam CD Key,17.0
Dead by Daylight EU PC Steam CD Key,6.31
Assassin's Creed Unity Ubisoft Connect CD Key,4.82
Ready Or Not EU Steam CD Key,18.46
SCUM PC Steam CD Key,10.28
Tom Clancy's Ghost Recon Wildlands EU Ubisoft Connect CD Key,5.85
Kingdom Come: Deliverance II Royal Edition PC Steam CD key,28.67
Dark Souls III PC Steam CD Key,18.23
Total War: ROME II Emperor Edition PC Steam CD Key,5.45
Code Vein Digital Deluxe Edition Steam CD Key,7.35
American Truck Simulator PC Steam CD Key,4.04
Planet Zoo Deluxe Edition PC Steam CD Key,7.84
Subnautica: Below Zero PC Steam CD Key,10.17
Little Nightmares III EU PC Steam CD Key,14.78
Yakuza: Like a Dragon PC Steam CD Key,5.25
Outward Definitive Edition PC Steam CD Key,5.83
The Elder Scrolls V: Skyrim Anniversary Edition PC Steam CD Key,13.29
Keep Talking and Nobody Explodes Steam CD Key,4.71
NBA 2K26 Standard Edition EU PC Steam CD Key,21.51
Total War: ATTILA - Tyrants & Kings Edition EU PC Steam CD Key,4.16
Battlefield 6 Phantom Edition PC Steam CD Key,64.29
Northgard: Definitive Edition PC Steam CD Key,4.57
Total War: WARHAMMER II EU PC Steam CD Key,5.79
Final Fantasy VII Steam CD Key,5.12
Beat Saber Meta Quest Gift,16.55
5 x Deluxe Mystery PC Steam CD Key,4.29
Kingdom Come: Deliverance II Royal Edition EU PC Steam CD key,29.56
S.T.A.L.K.E.R. 2: Heart of Chornobyl PC Steam CD Key,30.53
Battlefield 6 EU PC EA App INTEL Voucher (valid until March 2026),33.74
Resident Evil 3 EU PC Steam CD Key,7.67
BioShock: The Collection Steam CD Key,5.02
Resident Evil 7: Biohazard EU PC Steam CD Key,5.02
Detroit: Become Human RoW PC Steam CD Key,5.52
XCOM 2 Collection PC Steam CD Key,4.48
Tom Clancy's Ghost Recon Breakpoint EU Ubisoft Connect CD Key,6.55
Star Wars Outlaws: Gold Edition + Ubisoft+ Classics Subscription PC Ubisoft Connect INTEL Voucher (valid until February 2026),10.57
SILENT HILL f EU PC Steam CD Key,26.96
Crysis Remastered Trilogy PC Steam CD Key,9.67
X4: Foundations PC Steam CD Key,5.6
Assetto Corsa Rally PC Steam CD Key,14.75
It Takes Two PC EA App CD Key,7.86
Sid Meier’s Civilization VI Anthology PC Steam CD Key,10.34
Nioh: Complete Edition Steam CD Key,7.32
Bloons TD 6 Steam CD Key,6.75
Resident Evil 7 Gold Edition & Village Gold Edition Bundle PC Steam CD Key,15.49
Battle Brothers Steam CD Key,5.86
HITMAN World of Assassination EU PC Steam CD Key,16.97
Divinity: Original Sin 2 Definitive Edition GOG CD Key,15.34
Tropico 6 El Prez Edition PC Steam CD Key,6.3
Talisman: Digital 5th Edition PC Steam CD Key,7.33
Age of Empires II: Definitive Edition EU PC Steam CD Key,9.18
World War Z: Aftermath Steam CD Key,6.41
Fable III Complete Edition GFWL Download Key,12.14
Anno 117: Pax Romana + Pre-Order Bonus EU PC Ubisoft Connect CD Key,31.75
Street Fighter 6 EU Steam CD Key,10.68
Hollow Knight: Silksong PC Steam CD Key,10.62
Chivalry 2 PC Steam CD Key,4.96
Hogwarts Legacy Deluxe Edition PC Steam CD Key,6.32
Astroneer PC Steam CD Key,6.05
EA SPORTS FC 26 PC EA App CD Key,26.01
Rust EU Steam Altergift,30.02
Resident Evil 4 (2023) Gold Edition EU Steam CD Key,11.54
Crusader Kings III Steam CD Key,9.97
CODE VEIN II PC Steam CD Key,44.72
ULTRAKILL Steam CD Key,5.87
RESIDENT EVIL 2 / BIOHAZARD RE:2 EU Steam CD Key,6.3
The Elder Scrolls Online Standard Edition PC Steam CD Key,4.77
Euro Truck Simulator 2 PC Steam CD Key,9.83
JDM: Japanese Drift Master PC Steam CD Key,14.43
Sid Meier's Civilization V Complete Edition PC Steam CD Key,4.18
Fable III GFWL Download Key,10.4
Dark Souls: Remastered PC Steam CD Key,15.59
Assetto Corsa Competizione PC Steam CD Key,5.7
Anno 117: Pax Romana EU PC Ubisoft Connect CD Key,31.75
World of Warcraft: MidNight Epic Edition EU PC Battle.net Altergift,58.92
Hollow Knight PC Steam CD Key,5.27
Terraria PC Steam CD Key,5.47
METAL GEAR SOLID Δ: SNAKE EATER EU PC Steam CD Key,27.83
RimWorld Steam CD Key,17.65
Resident Evil Village EU Steam CD Key,5.21
Sonic Frontiers Steam CD Key,4.05
Len's Island PC Steam CD Key,8.93
Nine Sols PC Steam CD Key,5.09
Borderlands 4 EU PC Steam CD Key,32.02
Age of Empires IV: Anniversary Edition PC Steam CD Key,9.26
Ready Or Not PC Steam CD Key,19.33
Assetto Corsa Ultimate Edition PC Steam CD Key,12.18
Exotica 2: Pet Shop Simulator PC Steam CD Key,4.18
Grand Theft Auto V Enhanced PC Rockstar Digital Download CD Key,8.76
PEAK PC Steam CD Key,4.24
Shape of Dreams PC Steam CD Key,8.23
Football Manager 26 EU PC redeem.footballmanager.com CD Key,27.41
ARC Raiders: Deluxe Edition PC Steam CD Key,37.06
Stellaris GOG CD Key,14.69
Stellaris PC Steam CD Key,7.09
Bladesong PC Steam CD Key,6.87
Satisfactory PC Steam CD Key,23.05
Tomb Raider IV-VI Remastered EU PC Steam CD Key,4.21
Anno 1800 US PC Ubisoft Connect CD Key,11.72
Stray EU v2 Steam Altergift,22.82
City Car Driving Steam Altergift,19.26
Call of Duty: Black Ops Cold War XBOX One CD Key,16.19
Call of Duty: Black Ops Cold War EU XBOX One CD Key,15.22
Stray Steam Altergift,23.69
No Man's Sky PC Steam CD Key,13.58
New World Collection Bundle Steam CD Key,4.03
Fernbus Simulator EU PC Steam CD Key,11.58
Ultimate Random Key,4.57
Call of Duty: Black Ops Cold War US XBOX One CD Key,13.05
Resident Evil 4 (2023) EU Steam CD Key,8.68
StarRupture PC Steam CD Key,9.63
World of Warcraft: MidNight PC Battle.net Altergift,32.28
Elden Ring EU Steam CD Key,26.57
Tom Clancy's Rainbow Six Extraction Deluxe Edition XBOX One / Xbox Series X|S CD Key,18.15
The Last Oricru - Final Cut EN Language Only PC Steam CD Key,6.95
One Piece Odyssey Deluxe Edition EU v2 Steam Altergift,22.76
One Piece Odyssey Deluxe Edition Steam Altergift,22.76
World of Warcraft: MidNight Epic Edition PC Battle.net Altergift,56.65
Quarantine Zone: The Last Check PC Steam CD Key,11.71
Call of Duty: Modern Warfare II Cross-Gen Bundle EU XBOX One / Xbox Series X|S CD Key,33.53
Call of Duty: Modern Warfare II Cross-Gen Bundle US PS4/PS5 CD Key,16.53
One Piece Odyssey Steam Altergift,37.74
Atomic Heart Gold Edition EU v2 Steam Altergift,78.61
Vampire: The Masquerade - Sins of the Sires Steam CD Key,8.68
Watch Dogs: Legion Gold Edition EU XBOX One / Xbox Series X|S CD Key,21.74
Assassin's Creed Valhalla US PC Ubisoft Connect CD Key,9.56
WWE 2K BATTLEGROUNDS EU XBOX One CD Key,10.58
DayZ EU PC Steam Altergift,43.6
Scorn Deluxe Edition EU Steam CD Key,10.88
DayZ PC Steam Altergift,43.6
Need for Speed: Hot Pursuit Remastered EU XBOX One / Xbox Series X|S CD Key,6.79
Dragon Age 2 Ultimate Edition PC EA App CD Key,9.07
Conan Exiles EU/NA Steam CD Key,4.5
Like a Dragon: Ishin! Digital Deluxe Steam Altergift,64.89
Cleopatra Fortune S-Tribute Steam CD Key,14.0
Spongebob SquarePants: The Cosmic Shake Complete Edition Steam CD Key,13.25
Watch Dogs: Legion Deluxe Edition US PC Ubisoft Connect CD Key,12.57
God Of War Ragnarök Deluxe Edition US PS4/PS5 CD Key,39.15
Triangle Strategy Steam CD Key,18.14
Back 4 Blood Ultimate Edition SEA/Oceania PC Steam CD Key,14.79
Mount & Blade II: Bannerlord US PC Steam CD Key,15.05
BONELAB PC Steam CD Key,23.47
Resident Evil 4 (2023) RoW Steam CD Key,9.39
God Of War Ragnarök US PS5 CD Key,33.93
Hogwarts Legacy Digital Deluxe Edition EU Xbox Series X|S CD Key,11.3
Age of Empires II: Definitive Edition RoW PC Steam CD Key,9.18
Hello Neighbor 2 PC Steam CD Key,8.69
Call of Duty: Black Ops 6 EU PC Windows 10/11 CD Key,34.3
Cairn PC Steam CD Key,15.78
Fallout 4 GOTY Edition EU XBOX One CD Key,32.91
SpongeBob SquarePants: The Cosmic Shake EU XBOX One CD Key,14.66
Red Dead Redemption 2 Ultimate Edition EU Xbox Series X|S CD Key,16.52
Conan Exiles NA Steam CD Key,4.71
The Callisto Protocol Digital Deluxe Edition Steam Altergift,76.96
Raft Steam Altergift,16.9
Land of the Vikings EU PC Steam CD Key,5.12
Marvel's Midnight Suns EU Epic Games CD Key,9.27
ELDEN RING: Shadow of the Erdtree Edition EU XBOX One / Xbox Series X|S CD Key,60.38
PGA TOUR 2K23 EU PC Steam CD Key,24.46
Like a Dragon: Ishin! EU Steam CD Key,11.41
Just Dance 2023 Edition US Nintendo Switch CD Key,19.44
I Am Your President PC Steam CD Key,12.18
Just Dance 2023 Edition EU Xbox Series X|S CD Key,7.96
Fallout 4 EU XBOX One CD Key,15.62
Just Dance 2023 Edition EU PS5 CD Key,6.65
Fallout 4 VR PC Steam CD Key,13.92
Tom Clancy's Ghost Recon Breakpoint Deluxe Edition EU Ubisoft Connect CD Key,9.43
Fallout: New Vegas Ultimate Edition EU PC Steam CD Key,4.68
Fallout 76: The Pitt Deluxe Edition Steam CD Key,22.61
Transport Fever 2 EU Steam CD Key,11.78
Fallout Classic Collection PC Steam CD Key,7.18
Red Dead Redemption 2 Ultimate Edition PC Rockstar Digital Download CD Key,14.13
ONE PIECE ODYSSEY Deluxe Edition PC Steam CD Key,16.39
Scorn Deluxe Edition PC Steam CD Key,9.6
ARC Raiders EU PC Steam CD Key,24.36
Grounded EU Steam Altergift,15.87
VALKYRIE ELYSIUM PC Steam CD Key,18.14
The Callisto Protocol EU Steam Altergift,58.99
VALKYRIE ELYSIUM EU v2 Steam Altergift,19.8
Football Manager 2020 EU PC Steam CD Key,19.99
Satisfactory EU Steam Altergift,36.03
Total War: Warhammer Savage Edition EU PC Steam CD Key,6.07
Tiny Tina's Assault on Dragon Keep: A Wonderlands One-shot Adventure PC Steam CD Key,4.19
Just Dance 2023 Edition EU Nintendo Switch CD Key,9.0
Resident Evil 3 Steam CD Key,9.13
DayZ EU PC Steam CD Key,23.05
Total War: WARHAMMER III PC Steam CD Key,8.44
Infection Free Zone Steam Altergift,16.96
Like a Dragon: Infinite Wealth EU XBOX One / Xbox Series X|S / Windows 10 CD Key,42.63
Goat Simulator 3 EU Epic Games CD Key,6.73
AEW: Fight Forever Steam CD Key,4.91
AirportSim RoW Steam CD Key,12.68
Outer Wilds RoW Steam CD Key,8.33
The Elder Scrolls Online Deluxe Collection: Necrom EU XBOX One / XBOX Series X|S CD Key,30.77
Remnant II Deluxe Edition Steam CD Key,10.53
UFC 5 EU Xbox Series X|S CD Key,9.09
"Warhammer 40,000: Chaos Gate - Daemonhunters PC Steam CD Key",5.49
Fallout: New Vegas Ultimate Edition PC Steam CD Key,4.56
Darkest Dungeon: Ancestral Edition PC Steam CD Key,8.58
Hearts of Iron IV PC Steam CD Key,10.69
Ravenswatch PC Steam CD Key,7.37
Atomic Heart PC Steam CD Key,5.92
Immortals Fenyx Rising EU Ubisoft Connect CD Key,6.55
Zombi Ubisoft Connect CD Key,4.81
Chivalry 2 + Preorder Bonus Epic Games CD Key,7.49
Mafia III EU PC Steam CD Key,6.01
The Legend of Zelda: Tears of the Kingdom EU Nintendo Switch CD Key,54.85
﻿Crusader Kings III Royal Edition PC Steam CD Key,36.84
Crusader Kings III EU PC Steam CD Key,10.48
Desynced PC Steam CD Key,10.54
Wartales PC Steam CD Key,7.35
Assassin's Creed Mirage EU Ubisoft Connect CD Key,15.53
Mortal Kombat 1 EU/NA Steam CD Key,7.23
Avatar: Frontiers of Pandora EU Ubisoft Connect CD Key,18.97
The Inquisitor Steam CD Key,11.72
For The King II Steam Altergift,9.74
Elden Ring Steam Altergift,52.83
Elden Ring EU XBOX One / Xbox Series X|S CD Key,32.97
F1 Manager 2022 PC Steam CD Key,51.07
MotoGP 22 PC Steam CD Key,9.07
Tiny Tina's Wonderlands EU Epic Games CD Key,21.38
Super Mario Maker 2 US Nintendo Switch CD Key,64.11
NBA 2K22 PC Steam CD Key,99.99
Tom Clancy's Rainbow Six Extraction EU Ubisoft Connect CD Key,8.19
Elden Ring EU v2 Steam Altergift,55.63
The Room Three Steam Altergift,5.79
Dying Light 2 Stay Human EU v2 Steam Altergift,49.16
NBA 2K22 EU PC Steam CD Key,18.04
Paper Mario: The Origami King NA Nintendo Switch CD Key,37.39
Elden Ring NA/LATAM Steam CD Key,30.72
The Guild 3 EU Steam Altergift,5.01
The Room Steam Gift,43.49
F1 22 EA App CD Key,43.2
Expeditions: Rome Steam CD Key,4.28
Super Mario Odyssey US Nintendo Switch Key,35.66
Mario + Rabbids: Kingdom Battle EU Nintendo Switch CD Key,7.73
F1 2021 Steam CD Key,60.85
F1 2013 Classic Edition Steam CD Key,34.39
Monster Hunter: World PC Steam CD Key,7.31
Total War: WARHAMMER II PC Steam CD Key,10.13
Total War: Warhammer PC Steam CD Key,6.02
Red Dead Redemption 2 PC Rockstar Digital Download CD Key,10.85
Elden Ring RoW Steam CD Key,37.91
Forza Horizon 4 Standard Edition XBOX One / Windows 10 CD Key,20.4
PGA TOUR 2K25 EU PC Steam CD Key,21.32
F1 Manager 2022 RoW Steam CD Key,51.07
F1 Manager 2022 EU Steam CD Key,47.87
Gothic 1 Remake PRE-ORDER Steam CD Key,37.71
Metaphor: ReFantazio PC Steam CD Key,19.99
Hogwarts Legacy EU Steam CD Key,4.87
Assetto Corsa EVO PC Steam CD Key,19.0
The Slormancer PC Steam CD Key,7.7
Call of Duty: Vanguard EU XBOX One CD Key,16.2
Classified: France '44 PC Steam CD Key,8.42
Maneater EU Epic Games CD Key,4.09
The Room 4: Old Sins EU PC Steam Altergift,7.99
Back 4 Blood PC Steam Altergift,46.48
Ruined King: A League of Legends Story Steam Altergift,24.39
WRC 9 FIA World Rally Championship EU Epic Games CD Key,25.09
Black Myth: Wukong EU PC Steam Altergift,55.83
F1 2021 EU Steam CD Key,60.89
Steep EU Ubisoft Connect CD Key,4.51
Sekiro: Shadows Die Twice GOTY Edition AR XBOX One / Xbox Series X|S CD Key,8.68
The Forest EU Steam Altergift,13.64
The Room VR: A Dark Matter EU Steam Altergift,21.54
The Room VR: A Dark Matter Steam Altergift,21.54
DOOM: The Dark Ages Premium Edition + Pre-Order Bonus DLC PC Steam CD Key,69.59
Valheim EU Steam Altergift,9.14
The Forest Steam Gift,16.52
EA SPORTS FC 25 PC Steam CD Key,81.69
Sea of Thieves XBOX One / Windows 10 CD Key,17.92
Tales of Arise PC Steam CD Key,6.99
Return to Monkey Island EU v2 Steam Altergift,24.9
Alien: Rogue Incursion PC Steam CD Key,22.58
Ori and the Blind Forest: Definitive Edition EU XBOX One CD Key,4.18
Captain Tsubasa: Rise of New Champions Deluxe Edition PC Steam CD Key,6.64
Harmony: The Fall of Reverie Steam CD Key,14.78
NBA 2K23 EU PC Steam CD Key,24.95
Neon Abyss PC Steam CD Key,4.83
Icarus EU v2 Steam Altergift,34.65
FIFA 21 EA App CD Key,129.79
Age of Darkness: Final Stand PC Steam CD Key,10.26
Door Kickers 2: Task Force North PC Steam CD Key,19.51
ARK: Survival Evolved Steam Altergift,13.3
Elden Ring EMEA Steam CD Key,28.69
Battlefield 3 Premium Edition EA App CD Key,15.65
Microsoft Flight Simulator 2024 Aviator Edition Xbox Series X|S / PC CD Key,134.67
Fallout S.P.E.C.I.A.L Anthology Steam CD Key,28.7
Nier Replicant ver.1.22474487139... Steam CD Key,16.93
Football Manager 2022 EU PC Steam CD Key,19.46
HUMANKIND EU Steam CD Key,5.5
The Universim Steam CD Key,6.41
UNDER NIGHT IN-BIRTH II Sys:Celes PC Steam CD Key,16.69
MONSTER HUNTER RISE Steam CD Key,6.35
Steep X Games Gold Edition EU PC Ubisoft Connect CD Key,5.06
Mass Effect Legendary Edition EN Language Only EA App CD Key,12.21
Chained Together PC Steam Altergift,4.46
Mount & Blade II: Bannerlord EMEA Steam CD Key,14.81
ARK: Survival Evolved EU Nintendo Switch CD Key,8.08
Marvel's Avengers Steam CD Key,8.66
Grand Theft Auto V PC Rockstar Digital Download CD Key,8.87
Resident Evil Village Steam CD Key,7.08
Assassin's Creed Valhalla EU Ubisoft Connect CD Key,10.28
Indiana Jones and the Great Circle PC Steam CD Key,39.13
Hogwarts Legacy PC Steam CD Key,5.22
Gothic Universe Edition PC Steam CD Key,4.29
Kenshi Steam CD Key,6.84
Le Mans Ultimate PC Steam CD Key,15.21
Cities: Skylines II Steam CD Key,26.21
7 Days to Die Steam CD Key,12.89
Indiana Jones and the Great Circle Xbox Series X|S / PC CD Key,52.4
Football Manager 2023 EU redeem.footballmanager.com PC CD Key,31.22
AEW: Fight Forever Elite Edition Steam CD Key,7.25
Granblue Fantasy: Relink EU PC Steam CD Key,23.92
Football Manager 2023 EU PC Steam CD Key,14.14
EA Sports FC 24 EU XBOX One / Xbox Series X|S CD Key,14.87
Minecraft: Java & Bedrock Edition PC Windows CD Key,11.68
Marvel's Midnight Suns EU Steam CD Key,6.41
Football Manager 2024 EU PC redeem.footballmanager.com CD Key,118.31
Resident Evil Village Deluxe Edition Steam CD Key,20.87
The Precinct PC Steam CD Key,26.4
MONSTER HUNTER RISE Steam Altergift,36.46
EA SPORTS FC 25 EU XBOX One / Xbox Series X|S CD Key,16.74
Halo Infinite XBOX One / Windows 10 CD Key,11.93
Sid Meier's Civilization VI: Platinum Edition Steam CD Key,13.21
MONSTER HUNTER RISE EU PC Steam CD Key,5.21
EA SPORTS FC 25 XBOX One / Xbox Series X|S CD Key,15.22
DiRT 3 Complete Edition PC Steam CD Key,28.13
Monster Hunter Stories EU PC Steam CD Key,7.07
Kingdoms of Amalur: Re-Reckoning PC Steam CD Key,5.57
"Warhammer 40,000: Space Marine 2 EU PC Steam CD Key",19.0
Fallout 4 GOTY Edition PC Steam CD Key,10.39
Marvel's Spider-Man: Miles Morales PC Steam CD Key,43.5
Kingdom Hearts HD 2.8 Final Chapter Prologue PC Steam CD Key,27.66
Dead Season PC Steam CD Key,11.21
Horizon Forbidden West: Complete Edition PC Steam CD Key,52.8
Marvel's Spider-Man Remastered PC Steam CD Key,51.6
The Elder Scrolls III Morrowind GOTY GOG CD Key,6.8
Sand Land Deluxe Edition NA/LATAM Steam CD Key,48.33
Escape the Backrooms Steam CD Key,4.88
GTFO PC Steam CD Key,29.48
Lords of the Fallen (2023) RoW Steam CD Key,9.4
Sand Land NA/LATAM Steam CD Key,41.47
GOAL! The Club Manager Steam CD Key,13.04
Forza Horizon 5 XBOX One / Series X|S / Windows 10 CD Key,24.92
Mortal Kombat 1 EU Steam CD Key,7.22
The Quarry Deluxe Edition EU Steam CD Key,6.7
The Quarry Deluxe Edition Steam CD Key,7.13
Monster Hunter: World EU PC Steam CD Key,5.55
The Quarry Steam CD Key,4.34
Barony Steam Gift,4.02
Red Dead Redemption 2 Special Edition PC Rockstar Digital Download CD Key,14.66
Thrive: Heavy Lies The Crown RoW PC Steam CD Key,8.87
Prince of Persia The Lost Crown EU Ubisoft Connect CD Key,12.33
Dead Island 2 Gold Edition DE PC Steam CD Key,9.79
Gray Zone Warfare Steam CD Key,20.87
Mortal Kombat 1 Steam CD Key,7.23
Dragon's Dogma 2 RoW PC Steam CD Key,13.29
Metaphor: ReFantazio EU PC Steam CD Key,17.08
High On Life PC Steam CD Key,4.17
Mortal Kombat 1 Premium Edition Steam CD Key,15.27
Dying Light 2 Stay Human EU Steam CD Key,14.68
LEGO Star Wars: The Complete Saga EU PC Steam CD Key,8.04
MONSTER HUNTER RISE Deluxe Edition Steam CD Key,8.66
Horizon Zero Dawn Remastered PC Steam CD Key,43.5
FIFA 22 PC EA App CD Key,62.9
Bellwright Steam Altergift,26.74
LEGO Star Wars III: The Clone Wars PC GOG CD Key,6.03
Monsters Domain PC Steam CD Key,7.47
South Park: Snow Day! + Pre-Order Bonus DLC Steam CD Key,40.0
Total War: WARHAMMER III + Ogre Kingdoms Race Pack DLC EU PC Steam CD Key,87.11
FIFA 23 EN/FR/ES-MX/PT-BR/CH/KR/JP/AR Languages Only EA App CD Key,27.34
Call of Duty: Black Ops 6 EU PC Battle.net CD Key,96.57
The Last Faith Steam CD Key,12.81
Asterigos: Curse Of The Stars PC Steam CD Key,4.58
Manor Lords LATAM Steam CD Key,16.02
Kill It With Fire 2 PC Steam CD Key,8.27
Star Wars Outlaws: Gold Edition Xbox Series X|S CD Key,82.82
Escape from Tarkov: Standard Edition EU Digital Download CD Key,46.97
Star Wars: Jedi Fallen Order Steam CD Key,48.16
Battlefield 2042 EN/PL Languages Only EA App CD Key,9.5
Indiana Jones and the Great Circle Digital Premium Edition + Pre-order Bonus DLC PC Steam CD Key,347.99
Dragon's Dogma 2 Deluxe Edition RoW PC Steam CD Key,26.04
Indiana Jones and the Great Circle EU Xbox Series X|S / PC CD Key,58.46
ELEX II EU Steam CD Key,6.6
Need for Speed Unbound EA App CD Key,17.94
STAR WARS Battlefront II: Celebration Edition PC Steam CD Key,23.13
DRAGON QUEST III HD-2D Remake PC Steam Altergift,32.79
Tiny Tina's Wonderlands Chaotic Great Edition EU Epic Games CD Key,56.39
DRAGON QUEST III HD-2D Remake Xbox Series X|S CD Key,34.79
Dishonored 2 PC GOG CD Key,6.66
STAR WARS Jedi: Survivor Xbox Series X|S CD Key,11.65
Fallout 76 PC Steam CD Key,5.99
LEGO Star Wars III: The Clone Wars EU PC Steam CD Key,5.0
Dying Light Platinum Edition Steam CD Key,5.99
STAR WARS Jedi: Survivor Deluxe Edition EA App CD Key,16.53
LEGO Star Wars: The Skywalker Saga PC Steam CD Key,5.14
STAR WARS: Squadrons Steam CD Key,17.39
A Plague Tale: Innocence PC Steam CD Key,6.73
Star Wars: Jedi Fallen Order EA App CD Key,6.86
Fall Guys: Ultimate Knockout Steam CD Key,18.9
Star Wars Battlefront II (2005) Steam CD Key,4.52
Star Wars: The Force Unleashed II PC Steam CD Key,13.91
The Quarry EU Steam CD Key,5.03
Metal Gear Rising: Revengeance PC Steam CD Key,12.05
Star Wars Outlaws PC Ubisoft Connect CD Key,14.39
"Cities: Skylines (without NL,CN,KO) Steam CD Key",5.9
Kingdom Come: Deliverance II Gold Edition EU PC Steam CD Key,31.35
STAR WARS: Battlefront Classic Collection PC Steam CD Key,13.61
STAR WARS Jedi: Survivor EA App CD Key,10.98
DAVE THE DIVER Deluxe Edition PC Steam CD Key,8.52
LEGO Star Wars: The Skywalker Saga Galactic Edition Steam CD Key,9.96
Farming Simulator 22 PC Steam CD Key,24.9
LEGO Star Wars: The Complete Saga PC Steam CD Key,8.04
LEGO Star Wars: The Skywalker Saga Deluxe Edition EU PC Steam CD Key,4.22
ELEX II Steam CD Key,6.23
Kingdom Come: Deliverance II Gold Edition PC Steam CD Key,30.14
Frostpunk 2 PC Steam CD Key,13.3
LEGO Star Wars III: The Clone Wars PC Steam CD Key,4.88
Blue Prince EU PC Steam CD Key,11.02
Manor Lords PC Steam CD Key,13.8
Kingdom Come: Deliverance II EU PC Steam CD Key,20.66
LEGO Star Wars: The Skywalker Saga Deluxe Edition PC Steam CD Key,4.12
"Warhammer 40,000: Darktide PC Steam CD Key",6.35
For The King II PC Steam CD Key,4.79
Core Keeper PC Steam CD Key,5.75
Marvel's Spider-Man 2 EU PS5 CD Key,76.55
ELDEN RING: Shadow of the Erdtree Edition EMEA Steam CD Key,58.65
Metal Gear Solid: Master Collection Vol.1 EU PC Steam CD Key,37.83
ELDEN RING: Shadow of the Erdtree Deluxe Edition EMEA PC Steam CD Key,74.07
King Arthur: Legion IX PC Steam CD Key,5.2
Final Fantasy XIV - Dawntrail DLC EU PC Mog Station CD Key,25.22
Like a Dragon Gaiden: The Man Who Erased His Name EU Steam CD Key,4.33
Coral Island Steam CD Key,10.35
ASKA PC Steam CD Key,9.43
GUNDAM BREAKER 4 EU PC Steam CD Key,20.56
Visions of Mana EU PC Steam CD Key,30.55
TerraTech Worlds Steam CD Key,7.5
Level Zero: Extraction PC Steam CD Key,8.4
Anonymous Hacker Simulator Steam CD Key,10.21
It Takes Two Steam CD Key,49.59
S.T.A.L.K.E.R. 2: Heart of Chornobyl Ultimate Edition EU PC Steam CD Key,45.91
Homeworld 3 Deluxe Edition Steam CD Key,14.92
Quake IV GOG CD Key,5.98
Dead Rising Deluxe Remaster RoW PC Steam CD Key,19.78
Monster Energy Supercross 6 - The Official Videogame Steam CD Key,13.47
Kingdom Hearts 1.5 + 2.5 HD ReMIX PC Steam CD Key,23.12
Phantom Fury Steam CD Key,16.36
Returnal PC Steam CD Key,52.2
High On Life EU v2 Steam Altergift,28.89
Homeworld 3 Fleet Command Edition EU Steam CD Key,27.66
Harry Potter: Quidditch Champions Deluxe Edition + Pre-order Bonus DLC PC Steam CD Key,26.08
KNIGHT MYSTERY BOX,6.46
Planet Coaster 2 RoW PC Steam CD Key,23.3
Crisis Core: Final Fantasy VII Reunion Steam CD Key,16.52
PRINCE MYSTERY BOX,8.64
NBA 2K24 Kobe Bryant Edition EU Steam CD Key,10.06
Workers & Resources: Soviet Republic RoW Steam CD Key,5.43
S.T.A.L.K.E.R. 2: Heart of Chornobyl Deluxe Edition PC Steam CD Key,42.29
Octopath Traveler II Steam CD Key,21.52
HARVESTELLA Steam CD Key,19.1
WE ARE FOOTBALL 2024 PC Steam CD Key,13.25
For The King II EU Steam CD Key,4.88
Dragon's Dogma 2 Deluxe Edition EU Steam CD Key,24.7
Immortals of Aveum EA App CD Key,10.25
Nightingale Steam CD Key,15.53
Potion Craft: Alchemist Simulator PC Steam CD Key,7.42
Taxi Life: A City Driving Simulator PC Steam CD Key,8.38
Starfield EU Steam CD Key,42.62
ELDEN RING: Shadow of the Erdtree Edition EU Steam CD Key,58.36
RIDE 5 Steam CD Key,17.03
NARUTO X BORUTO Ultimate Ninja STORM CONNECTIONS Steam CD Key,16.26
DOOM Eternal PC Steam CD Key,7.2
Sonic x Shadow Generations EU PC Steam CD Key,18.25
Mafia Trilogy EU Steam CD Key,7.52
Balatro PC Steam CD Key,8.93
Dragon's Dogma 2 EU Xbox Series X|S CD Key,25.92
S.T.A.L.K.E.R. 2: Heart of Chornobyl Ultimate Edition EU/NA PC Steam CD Key,44.55
Palworld EU Xbox Series X|S / Windows 10/11 CD Key,24.7
The Crew Motorfest EU PC Ubisoft Connect CD Key,10.81
NBA 2K25 EU PC Steam CD Key,14.58
Expeditions: A MudRunner Game Steam CD Key,13.62
Sifu Steam CD Key,5.52
Hogwarts Legacy EU/NA PC Steam CD Key,5.05
Deep Rock Galactic PC Steam CD Key,7.15
Two Point Museum Explorer Edition EU PC Steam CD Key,15.92
Yakuza: Like a Dragon EU PC Steam CD Key,5.12
Hell Let Loose PC Steam CD Key,14.63
Armored Core VI - Fires of Rubicon EU Steam CD Key,16.74
