title,price_eur
Lords of the Fallen (2023) Deluxe Edition Steam CD Key,12.25
PowerWash Simulator Steam CD Key,8.67
Microsoft Flight Simulator 2024 Xbox Series X|S / PC CD Key,43.89
10 x Diamond Mystery PC Steam CD Key,9.23
SILENT HILL 2 EU PC Steam CD Key,20.21
Persona 3 Reload EU Steam CD Key,15.88
Dragon's Dogma 2 EU Steam CD Key,11.3
Manor Lords EU Steam CD Key,13.29
HELLDIVERS Digital Deluxe Edition PC Steam СD Key,26.1
Outcast 2: A New Beginning PC Steam CD Key,6.94
God of War PC Steam CD Key,44.0
The Outlast Trials PC Steam CD Key,11.62
NBA 2K24 Black Mamba Edition EU Steam CD Key,21.99
Broken Roads PC Steam CD Key,12.91
Ghostrunner 2 PC Steam CD Key,38.31
Homeworld 3 Fleet Command Edition Steam CD Key,16.7
Football Manager 2024 EU PC Steam CD Key,434.99
Geo-Political Simulator 5 PC Steam CD Key,20.31
Test Drive Unlimited Solar Crown EU PC Steam CD Key,10.88
Pax Dei EU PC Steam CD Key,11.25
shapez 2 PC Steam CD Key,9.68
Norland PC Steam CD Key,8.1
EA Sports FC 24 PC EA App CD Key,13.04
Undisputed PC Steam CD Key,16.86
The Callisto Protocol Steam CD Key,4.67
Dead Island 2 Pulp Edition EU Epic Games CD Key,18.01
"Warhammer 40,000: Space Marine 2 Gold Edition PC Steam CD Key",29.03
HELLCARD PC Steam CD Key,8.37
Kerbal Space Program 2 EU Steam CD Key,31.46
New World: Aeternum Xbox Series X|S CD Key,47.47
EA Sports FC 24 EN/PL Languages Only EA App CD Key,14.96
Jurassic World Evolution 2 PC Steam CD Key,6.75
Days Gone PC Steam CD Key,35.2
Hogwarts Legacy Deluxe Edition EU XBOX One / Xbox Series X|S CD Key,14.34
Mortal Kombat 1 Premium Edition EU/NA Steam CD Key,15.27
Manor Lords CN Steam CD Key,16.07
Call of Duty: Modern Warfare III Cross-Gen Bundle EU XBOX One / Xbox Series X|S CD Key,47.53
Marauders PC Steam CD Key,26.1
Millennia PC Steam CD Key,13.92
Clair Obscur: Expedition 33 Deluxe Edition PC Steam Altergift,52.5
Call of Duty: Modern Warfare II Cross-Gen Bundle US XBOX One / Xbox Series X|S CD Key,29.48
The Last of Us Part 1 Digital Deluxe Edition PC Steam CD Key,60.9
F1 Manager 2023 Steam CD Key,6.86
Keyhole Spy: Student Girls Steam CD Key,48.71
Last Whisper PC Steam CD Key,8.92
PAYDAY 3 Gold Edition Steam CD Key,23.39
Norland RoW PC Steam CD Key,8.58
Escape from Tarkov: Standard Edition Digital Download CD Key,45.04
Remnant II Ultimate Edition Steam CD Key,28.8
Drug Dealer Simulator 2 PC Steam CD Key,10.91
Gord Deluxe Edition PC Steam CD Key,6.97
Senua’s Saga: Hellblade II EU Xbox Series X|S / PC CD Key,9.37
Cataclismo RoW PC Steam CD Key,10.03
Dynasty Warriors: Origins EU PC Steam CD Key,50.92
NARUTO SHIPPUDEN: Ultimate Ninja STORM 4 Road to Boruto Steam CD Key,18.17
Test Drive Unlimited Solar Crown PC Steam CD Key,11.9
Construction Simulator Extended Edition PC Steam CD Key,23.79
Cyberpunk 2077 EU Steam Altergift,75.39
Deathbound PC Steam CD Key,5.61
Resident Evil 4 (2023) Deluxe Edition Steam CD Key,96.69
Kunitsu-Gami: Path of the Goddess RoW PC Steam CD Key,19.97
Sackboy: A Big Adventure PC Steam CD Key,52.2
FIFA 23 EA App CD Key,21.74
Rogue Waters PC Steam CD Key,7.52
Dead Space Remake PC EA App CD Key,15.65
Gord PC Steam CD Key,6.1
Ratchet & Clank Rift Apart PC Steam CD Key,52.2
Diablo IV Deluxe Edition EU XBOX One / Xbox Series X|S CD Key,29.1
Atomfall Deluxe Edition + Pre-Order Bonus PC Steam CD Key,37.19
WWE 2K24 EU PC Steam CD Key,33.06
Crown Wars: The Black Prince Steam CD Key,5.56
Call of Duty: Modern Warfare II EU v2 Steam Altergift,67.6
Children of the Sun PC Steam CD Key,4.85
Brothers: A Tale of Two Sons Remake PC Steam CD Key,5.57
EA Sports FC 24 Ultimate Edition EA App CD Key,82.65
Monster Jam Showdown PC Steam CD Key,30.55
Diablo IV EU XBOX One / Xbox Series X|S CD Key,23.05
Anger Foot PC Steam CD Key,6.86
Skull & Bones EU PC Ubisoft Connect CD Key,13.52
Blood Bowl 3 - Brutal Edition EU Steam CD Key,19.8
The Last of Us Part 1 PC Steam CD Key,52.8
Forspoken PC Steam CD Key,18.14
Hearts of Iron IV: Cadet Edition RoW Steam CD Key,11.74
Greedfall II: The Dying World EU PC Steam CD Key,23.88
Sand Land PC Steam CD Key,20.65
SCP: 5K Steam CD Key,14.29
Wo Long: Fallen Dynasty Steam CD Key,22.21
Aliens: Fireteam Elite PC Steam CD Key,6.96
Baldur's Gate 3 EU Steam Altergift,52.54
Redfall Steam CD Key,11.76
GhostWire: Tokyo PC Steam CD Key,6.33
Ship Graveyard Simulator 2 PC Steam CD Key,5.06
Palworld EU PC Steam CD Key,21.31
Gray Zone Warfare RoW PC Steam CD Key,20.36
Temtem PC Steam CD Key,6.92
The First Berserker: Khazan Deluxe Edition RoW PC Steam CD Key,29.75
Way of the Hunter Steam CD Key,5.41
God Of War Ragnarök EU PS5 CD Key,47.22
HUMANKIND Definitive Edition RoW Steam CD Key,43.01
IXION Steam CD Key,7.8
Volcanoids PC Steam CD Key,8.22
Six Days in Fallujah Steam CD Key,13.03
Terminator: Dark Fate - Defiance PC Steam CD Key,13.29
Endzone 2 PC Steam CD Key,6.26
One Piece Odyssey PC Steam CD Key,10.52
5 x LEGO Mystery Steam CD Key,6.71
5 x VR Mystery Steam CD Key,7.55
PAYDAY 3 Steam CD Key,12.39
TEKKEN 8 RoW Steam CD Key,16.96
Dying Light 2 Stay Human PC Steam CD Key,13.55
Red Dead Redemption 2 Epic Games Green Gift Redemption Code,9.63
Remnant II PC Steam CD Key,9.12
Last Train Home PC Steam CD Key,9.54
The Great War: Western Front Steam CD Key,4.21
3 x VR Mystery Steam CD Key,5.02
Frostpunk 2 Deluxe Edition PC Steam CD Key,22.03
3 x LEGO Mystery Steam CD Key,4.19
Roots of Pacha Steam CD Key,12.17
WWE 2K25 PC Steam CD Key,11.05
Construction Simulator PC Steam CD Key,11.22
Like a Dragon: Infinite Wealth EU Steam CD Key,15.83
Alone in the Dark PC Steam CD Key,10.31
Dead by Daylight PC Steam CD Key,11.28
Final Fantasy XVI Complete Edition PC Steam CD Key,25.14
Age of Wonders 4 Premium Edition Steam CD Key,26.31
Remnant: From the Ashes Complete Edition Steam CD Key,6.29
Final Fantasy XVI PC Steam CD Key,18.49
Sengoku Dynasty Steam CD Key,11.25
5 x Diamond Mystery PC Steam CD Key,4.19
Lords of the Fallen (2023) PC Steam CD Key,9.11
The Jackbox Party Pack 5 PC Steam CD Key,7.82
Pacific Drive PC Steam CD Key,8.88
Armored Core VI: Fires of Rubicon Steam CD Key,18.61
Banishers: Ghosts of New Eden PC Steam CD Key,4.31
Age of Wonders 4 PC Steam CD Key,15.44
The Walking Dead: The Telltale Definitive Series Steam CD Key,7.66
DayZ RoW PC Steam CD Key,23.13
Cyberpunk 2077 PC GOG CD Key,22.01
SILENT HILL 2 PC Steam CD Key,21.28
Cities: Skylines II Ultimate Edition PC Steam CD Key,59.15
DRAGON BALL: Sparking! ZERO EU PC Steam CD Key,24.07
Valheim PC Steam CD Key,8.87
BIOMUTANT Steam CD Key,4.71
Dead Island 2 PC Steam CD Key,7.02
Resident Evil 4 (2023) PC Steam CD Key,15.12
Starfield PC Steam CD Key,42.61
Victoria 3 PC Steam CD Key,9.47
Company of Heroes 3 EU Steam CD Key,14.07
Sea of Stars Steam CD Key,10.83
Persona 5 Royal EU PC Steam CD Key,10.14
A Plague Tale: Requiem Steam CD Key,10.57
Abiotic Factor PC Steam CD Key,18.74
Nioh 2 The Complete Edition PC Steam CD Key,20.76
Barotrauma Steam CD Key,6.99
Palworld PC Steam CD Key,19.99
DOOM Eternal Deluxe Edition PC Steam CD Key,7.83
Street Fighter 6 PC Steam CD Key,12.9
Lies of P PC Steam CD Key,15.15
Workers & Resources: Soviet Republic PC Steam CD Key,5.43
Path of Exile 2 Early Access PC Official website CD Key,13.36
10 x Deluxe Mystery PC Steam CD Key,6.71
Fallout 4 Steam CD Key,5.6
Subnautica PC Steam CD Key,11.48
The Elder Scrolls V: Skyrim Special Edition PC Steam CD Key,7.84
Mount & Blade II: Bannerlord PC Steam CD Key,14.65
HumanitZ Steam CD Key,6.07
"Warhammer 40,000: Rogue Trader PC Steam CD Key",6.6
Hunt: Showdown 1896 PC Steam CD Key,5.07
Kingdom Come: Deliverance II PC Steam CD Key,20.66
Clair Obscur: Expedition 33 EU PC Steam CD Key,19.88
Total War: WARHAMMER III EU PC Steam CD Key,7.71
Tempest Rising PC Steam CD Key,25.48
DOOM: The Dark Ages + Pre-Order Bonus DLC PC Steam CD Key,61.73
HELLDIVERS 2 PC Steam CD Key,35.2
Kingdom Come: Deliverance Royal Edition PC Steam CD Key,4.3
The King Is Watching PC Steam CD Key,9.6
Mandragora: Whispers of the Witch Tree PC Steam CD Key,24.55
Last Epoch PC Steam CD Key,42.88
Arma Reforger EU v2 Steam Altergift,33.75
Final Fantasy VII Rebirth PC Steam CD Key,25.8
Split Fiction PC EA App CD Key,34.96
Enshrouded PC Steam CD Key,17.83
10 x Premium Mystery PC Steam CD Key,5.45
V Rising PC Steam CD Key,5.55
Minecraft: Java & Bedrock Edition for PC CD Key,11.27
Pax Augusta PC Steam CD Key,7.17
Stronghold Crusader: Definitive Edition PC Steam CD Key,10.03
F1 25 PC Steam Altergift,53.69
Broken Arrow PC Steam CD Key,20.1
ELDEN RING NIGHTREIGN EU PC Steam CD Key,20.59
Avowed Xbox Series X|S / PC CD Key,36.08
Rune Factory: Guardians of Azuma PC Steam CD Key,24.89
Like a Dragon: Pirate Yakuza in Hawaii EU PC Steam CD Key,14.6
REMATCH PC Steam CD Key,12.56
RoadCraft PC Steam CD Key,19.29
Ghost of Tsushima Director's Cut PC Steam CD Key,52.8
Farming Simulator 25 PC Steam CD Key,26.4
FANTASY LIFE i: The Girl Who Steals Time PC Steam Altergift,53.69
Borderlands 4 Xbox Series X|S CD Key,41.58
DOOM: The Dark Ages PC Steam CD Key,26.32
Assassin’s Creed Shadows PC Ubisoft Connect CD Key,27.26
Survival Machine PC Steam CD Key,11.21
Sid Meier's Civilization VII EU PC Steam CD Key,49.96
The Elder Scrolls IV: Oblivion GOTY Edition Deluxe Steam CD Key,4.44
The First Berserker: Khazan EU PC Steam CD Key,20.94
"Warhammer 40,000: Space Marine 2 PC Steam CD Key",18.83
Monster Hunter Wilds EU PC Steam CD Key,22.94
Clair Obscur: Expedition 33 PC Steam CD Key,19.35
The Elder Scrolls IV: Oblivion Remastered Deluxe Edition PC Steam CD Key,31.24
Origins RoW (Steam) Mystery Steam CD Key,4.19
Clair Obscur: Expedition 33 Deluxe Edition PC Steam CD Key,24.17
The Elder Scrolls IV: Oblivion Remastered PC Steam CD Key,25.19
Call of Duty: Black Ops 6 PC Battle.net Altergift,44.98
Grand Theft Auto V: Premium Online Edition Rockstar Digital Download CD Key,8.4
Europa Universalis V Premium Edition PC Steam CD Key,62.79
NIGHTREIGN (EU Steam) Mystery Steam CD Key,5.03
Europa Universalis V PC Steam CD Key,41.55
Battlefield 6 PC EA App CD Key,50.36
Football Manager 26 EU PC Steam CD Key,31.55
Call of Duty: Black Ops 7 PC Battle.net Altergift,68.86
ARC Raiders PC Steam CD Key,24.93
